Sub Tema Surga;Surah;Ayat;Terjemahan
Nama-nama Surga;4;95;Tidaklah sama antara mukmin yang duduk (yang tidak ikut berperang) yang tidak mempunyai ´uzur dengan orang-orang yang berjihad di jalan Allah dengan harta mereka dan jiwanya. Allah melebihkan orang-orang yang berjihad dengan harta dan jiwanya atas orang-orang yang duduk satu derajat. Kepada masing-masing mereka Allah menjanjikan pahala yang baik (surga) dan Allah melebihkan orang-orang yang berjihad atas orang yang duduk dengan pahala yang besar,
Nama-nama Surga;6;127;Bagi mereka (disediakan) darussalam (surga) pada sisi Tuhannya dan Dialah Pelindung mereka disebabkan amal-amal saleh yang selalu mereka kerjakan.
Nama-nama Surga;9;72;"Allah menjanjikan kepada orang-orang mukmin, lelaki dan perempuan, (akan mendapat) surga yang dibawahnya mengalir sungai-sungai, kekal mereka di dalamnya, dan (mendapat) tempat-tempat yang bagus di surga ´Adn. Dan keridhaan Allah adalah lebih besar; itu adalah keberuntungan yang besar."
Nama-nama Surga;10;9;Sesungguhnya orang-orang yang beriman dan mengerjakan amal-amal saleh, mereka diberi petunjuk oleh Tuhan mereka karena keimanannya, di bawah mereka mengalir sungai-sungai di dalam surga yang penuh kenikmatan.
Nama-nama Surga;10;25;Allah menyeru (manusia) ke Darussalam (surga), dan menunjuki orang yang dikehendaki-Nya kepada jalan yang lurus (Islam).
Nama-nama Surga;13;18;Bagi orang-orang yang memenuhi seruan Tuhannya, (disediakan) pembalasan yang baik. Dan orang-orang yang tidak memenuhi seruan Tuhan, sekiranya mereka mempunyai semua (kekayaan) yang ada di bumi dan (ditambah) sebanyak isi bumi itu lagi besertanya, niscaya mereka akan menebus dirinya dengan kekayaan itu. Orang-orang itu disediakan baginya hisab yang buruk dan tempat kediaman mereka ialah Jahanam dan itulah seburuk-buruk tempat kediaman.
Nama-nama Surga;13;23;"(yaitu) surga ´Adn yang mereka masuk ke dalamnya bersama-sama dengan orang-orang yang saleh dari bapak-bapaknya, isteri-isterinya dan anak cucunya, sedang malaikat-malaikat masuk ke tempat-tempat mereka dari semua pintu;"
Nama-nama Surga;13;29;Orang-orang yang beriman dan beramal saleh, bagi mereka kebahagiaan dan tempat kembali yang baik.
Nama-nama Surga;16;30;"Dan dikatakan kepada orang-orang yang bertakwa: ""Apakah yang telah diturunkan oleh Tuhanmu?"" Mereka menjawab: ""(Allah telah menurunkan) kebaikan"". Orang-orang yang berbuat baik di dunia ini mendapat (pembalasan) yang baik. Dan sesungguhnya kampung akhirat adalah lebih baik dan itulah sebaik-baik tempat bagi orang yang bertakwa,"
Nama-nama Surga;16;31;(yaitu) surga ´Adn yang mereka masuk ke dalamnya, mengalir di bawahnya sungai-sungai, di dalam surga itu mereka mendapat segala apa yang mereka kehendaki. Demikianlah Allah memberi balasan kepada orang-orang yang bertakwa,
Nama-nama Surga;16;62;Dan mereka menetapkan bagi Allah apa yang mereka sendiri membencinya, dan lidah mereka mengucapkan kedustaan, yaitu bahwa sesungguhnya merekalah yang akan mendapat kebaikan. Tiadalah diragukan bahwa nerakalah bagi mereka, dan sesungguhnya mereka segera dimasukkan (ke dalamnya).
Nama-nama Surga;18;31;"Mereka itulah (orang-orang yang) bagi mereka surga ´Adn, mengalir sungai-sungai di bawahnya; dalam surga itu mereka dihiasi dengan gelang mas dan mereka memakai pakaian hijau dari sutera halus dan sutera tebal, sedang mereka duduk sambil bersandar di atas dipan-dipan yang indah. Itulah pahala yang sebaik-baiknya, dan tempat istirahat yang indah;"
Nama-nama Surga;18;88;"Adapun orang-orang yang beriman dan beramal saleh, maka baginya pahala yang terbaik sebagai balasan, dan akan kami titahkan kepadanya (perintah) yang mudah dari perintah-perintah kami""."
Nama-nama Surga;18;107;Sesungguhnya orang-orang yang beriman dan beramal saleh, bagi mereka adalah surga Firdaus menjadi tempat tinggal,
Nama-nama Surga;19;61;yaitu surga ´Adn yang telah dijanjikan oleh Tuhan Yang Maha Pemurah kepada hamba-hamba-Nya, sekalipun (surga itu) tidak nampak. Sesungguhnya janji Allah itu pasti akan ditepati.
Nama-nama Surga;20;76;(yaitu) surga ´Adn yang mengalir sungai-sungai di bawahnya, mereka kekal di dalamnya. Dan itu adalah balasan bagi orang yang bersih (dari kekafiran dan kemaksiatan).
Nama-nama Surga;21;101;Bahwasanya orang-orang yang telah ada untuk mereka ketetapan yang baik dari Kami, mereka itu dijauhkan dari neraka,
Nama-nama Surga;22;56;Kekuasaan di hari itu ada pada Allah, Dia memberi keputusan di antara mereka. Maka orang-orang yang beriman dan beramal saleh adalah di dalam surga yang penuh kenikmatan.
Nama-nama Surga;23;11;(yakni) yang akan mewarisi surga Firdaus. Mereka kekal di dalamnya.
Nama-nama Surga;25;15;"Katakanlah: ""Apa (azab) yang demikian itukah yang baik, atau surga yang kekal yang telah dijanjikan kepada orang-orang yang bertakwa?"" Dia menjadi balasan dan tempat kembali bagi mereka?""."
Nama-nama Surga;25;75;Mereka itulah orang yang dibalasi dengan martabat yang tinggi (dalam surga) karena kesabaran mereka dan mereka disambut dengan penghormatan dan ucapan selamat di dalamnya,
Nama-nama Surga;26;85;dan jadikanlah aku termasuk orang-orang yang mempusakai surga yang penuh kenikmatan,
Nama-nama Surga;31;8;Sesungguhnya orang-orang yang beriman dan mengerjakan amal-amal saleh, bagi mereka surga-surga yang penuh kenikmatan,
Nama-nama Surga;35;33;(Bagi mereka) surga ´Adn mereka masuk ke dalamnya, di dalamnya mereka diberi perhiasan dengan gelang-gelang dari emas, dan dengan mutiara, dan pakaian mereka didalamnya adalah sutera.
Nama-nama Surga;35;35;"Yang menempatkan kami dalam tempat yang kekal (surga) dari karunia-Nya; didalamnya kami tiada merasa lelah dan tiada pula merasa lesu""."
Nama-nama Surga;37;43;di dalam surga-surga yang penuh nikmat.
Nama-nama Surga;38;50;(yaitu) surga ´Adn yang pintu-pintunya terbuka bagi mereka,
Nama-nama Surga;40;8;ya Tuhan kami, dan masukkanlah mereka ke dalam surga ´Adn yang telah Engkau janjikan kepada mereka dan orang-orang yang saleh di antara bapak-bapak mereka, dan isteri-isteri mereka, dan keturunan mereka semua. Sesungguhnya Engkaulah Yang Maha Perkasa lagi Maha Bijaksana,
Nama-nama Surga;40;39;Hai kaumku, sesungguhnya kehidupan dunia ini hanyalah kesenangan (sementara) dan sesungguhnya akhirat itulah negeri yang kekal.
Nama-nama Surga;41;50;"Dan jika Kami merasakan kepadanya sesuatu rahmat dari Kami sesudah dia ditimpa kesusahan, pastilah dia berkata: ""Ini adalah hakku, dan aku tidak yakin bahwa hari Kiamat itu akan datang. Dan jika aku dikembalikan kepada Tuhanku maka sesungguhnya aku akan memperoleh kebaikan pada sisi-Nya"". Maka Kami benar-benar akan memberitakan kepada orang-orang kafir apa yang telah mereka kerjakan dan akan Kami rasakan kepada mereka azab yang keras."
Nama-nama Surga;56;12;Berada dalam jannah kenikmatan.
Nama-nama Surga;56;89;maka dia memperoleh ketenteraman dan rezeki serta jannah kenikmatan.
Nama-nama Surga;57;10;Dan mengapa kamu tidak menafkahkan (sebagian hartamu) pada jalan Allah, padahal Allah-lah yang mempusakai (mempunyai) langit dan bumi? Tidak sama di antara kamu orang yang menafkahkan (hartanya) dan berperang sebelum penaklukan (Mekah). Mereka lebih tingi derajatnya daripada orang-orang yang menafkahkan (hartanya) dan berperang sesudah itu. Allah menjanjikan kepada masing-masing mereka (balasan) yang lebih baik. Dan Allah mengetahui apa yang kamu kerjakan.
Nama-nama Surga;61;12;"Niscaya Allah akan mengampuni dosa-dosamu dan memasukkanmu ke dalam jannah yang mengalir di bawahnya sungai-sungai; dan (memasukkan kamu) ke tempat tinggal yang baik di dalam jannah ´Adn. Itulah keberuntungan yang besar."
Nama-nama Surga;68;34;Sesungguhnya bagi orang-orang yang bertakwa (disediakan) surga-surga yang penuh kenikmatan di sisi Tuhannya.
Nama-nama Surga;69;22;dalam surga yang tinggi,
Nama-nama Surga;70;38;Adakah setiap orang dari orang-orang kafir itu ingin masuk ke dalam surga yang penuh kenikmatan?,
Nama-nama Surga;88;10;dalam surga yang tinggi,
Nama-nama Surga;92;6;dan membenarkan adanya pahala yang terbaik (surga),
Nama-nama Surga;92;9;serta mendustakan pahala terbaik,
Nama-nama Surga;98;8;"Balasan mereka di sisi Tuhan mereka ialah surga ´Adn yang mengalir di bawahnya sungai-sungai; mereka kekal di dalamnya selama-lamanya. Allah ridha terhadap mereka dan merekapun ridha kepada-Nya. Yang demikian itu adalah (balasan) bagi orang yang takut kepada Tuhannya."
Keabadian Surga;2;25;"Dan sampaikanlah berita gembira kepada mereka yang beriman dan berbuat baik, bahwa bagi mereka disediakan surga-surga yang mengalir sungai-sungai di dalamnya. Setiap mereka diberi rezeki buah-buahan dalam surga-surga itu, mereka mengatakan: ""Inilah yang pernah diberikan kepada kami dahulu"". Mereka diberi buah-buahan yang serupa dan untuk mereka di dalamnya ada isteri-isteri yang suci dan mereka kekal di dalamnya."
Keabadian Surga;2;82;"Dan orang-orang yang beriman serta beramal saleh, mereka itu penghuni surga; mereka kekal di dalamnya."
Keabadian Surga;3;15;"Katakanlah: ""Inginkah aku kabarkan kepadamu apa yang lebih baik dari yang demikian itu?"". Untuk orang-orang yang bertakwa (kepada Allah), pada sisi Tuhan mereka ada surga yang mengalir dibawahnya sungai-sungai; mereka kekal didalamnya. Dan (mereka dikaruniai) isteri-isteri yang disucikan serta keridhaan Allah. Dan Allah Maha Melihat akan hamba-hamba-Nya."
Keabadian Surga;3;107;"Adapun orang-orang yang putih berseri mukanya, maka mereka berada dalam rahmat Allah (surga); mereka kekal di dalamnya."
Keabadian Surga;3;136;"Mereka itu balasannya ialah ampunan dari Tuhan mereka dan surga yang di dalamnya mengalir sungai-sungai, sedang mereka kekal di dalamnya; dan itulah sebaik-baik pahala orang-orang yang beramal."
Keabadian Surga;3;198;Akan tetapi orang-orang yang bertakwa kepada Tuhannya, bagi mereka surga yang mengalir sungai-sungai di dalamnya, sedang mereka kekal di dalamnya sebagai tempat tinggal (anugerah) dari sisi Allah. Dan apa yang di sisi Allah adalah lebih baik bagi orang-orang yang berbakti.
Keabadian Surga;4;13;"(Hukum-hukum tersebut) itu adalah ketentuan-ketentuan dari Allah. Barangsiapa taat kepada Allah dan Rasul-Nya, niscaya Allah memasukkannya kedalam surga yang mengalir didalamnya sungai-sungai, sedang mereka kekal di dalamnya; dan itulah kemenangan yang besar."
Keabadian Surga;4;57;"Dan orang-orang yang beriman dan mengerjakan amalan-amalan yang shaleh, kelak akan Kami masukkan mereka ke dalam surga yang di dalamnya mengalir sungai-sungai; kekal mereka di dalamnya; mereka di dalamnya mempunyai isteri-isteri yang suci, dan Kami masukkan mereka ke tempat yang teduh lagi nyaman."
Keabadian Surga;4;122;Orang-orang yang beriman dan mengerjakan amalan saleh, kelak akan Kami masukkan ke dalam surga yang mengalir sungai-sungai di dalamnya, mereka kekal di dalamnya selama-lamanya. Allah telah membuat suatu janji yang benar. Dan siapakah yang lebih benar perkataannya dari pada Allah?
Keabadian Surga;5;85;Maka Allah memberi mereka pahala terhadap perkataan yang mereka ucapkan, (yaitu) surga yang mengalir sungai-sungai di dalamnya, sedang mereka kekal di dalamnya. Dan itulah balasan (bagi) orang-orang yang berbuat kebaikan (yang ikhlas keimanannya).
Keabadian Surga;5;119;"Allah berfirman: ""Ini adalah suatu hari yang bermanfaat bagi orang-orang yang benar kebenaran mereka. Bagi mereka surga yang dibawahnya mengalir sungai-sungai; mereka kekal di dalamnya selama-lamanya; Allah ridha terhadap-Nya. Itulah keberuntungan yang paling besar""."
Keabadian Surga;7;42;"dan orang-orang yang beriman dan mengerjakan amal-amal yang saleh, Kami tidak memikulkan kewajiban kepada diri seseorang melainkan sekedar kesanggupannya, mereka itulah penghuni-penghuni surga; mereka kekal di dalamnya."
Keabadian Surga;9;21;Tuhan mereka menggembirakan mereka dengan memberikan rahmat dari pada-Nya, keridhaan dan surga, mereka memperoleh didalamnya kesenangan yang kekal,
Keabadian Surga;9;22;mereka kekal di dalamnya selama-lamanya. Sesungguhnya di sisi Allah-lah pahala yang besar.
Keabadian Surga;9;72;"Allah menjanjikan kepada orang-orang mukmin, lelaki dan perempuan, (akan mendapat) surga yang dibawahnya mengalir sungai-sungai, kekal mereka di dalamnya, dan (mendapat) tempat-tempat yang bagus di surga ´Adn. Dan keridhaan Allah adalah lebih besar; itu adalah keberuntungan yang besar."
Keabadian Surga;9;89;Allah telah menyediakan bagi mereka surga yang mengalir di bawahnya sungai-sungai, mereka kekal di dalamnya. Itulah kemenangan yang besar.
Keabadian Surga;9;100;Orang-orang yang terdahulu lagi yang pertama-tama (masuk Islam) dari golongan muhajirin dan anshar dan orang-orang yang mengikuti mereka dengan baik, Allah ridha kepada mereka dan merekapun ridha kepada Allah dan Allah menyediakan bagi mereka surga-surga yang mengalir sungai-sungai di dalamnya selama-lamanya. Mereka kekal di dalamnya. Itulah kemenangan yang besar.
Keabadian Surga;10;26;Bagi orang-orang yang berbuat baik, ada pahala yang terbaik (surga) dan tambahannya. Dan muka mereka tidak ditutupi debu hitam dan tidak (pula) kehinaan. Mereka itulah penghuni surga, mereka kekal di dalamnya.
Keabadian Surga;11;23;"Sesungguhnya orang-orang yang beriman dan mengerjakan amal-amal saleh dan merendahkan diri kepada Tuhan mereka, mereka itu adalah penghuni-penghuni surga; mereka kekal di dalamnya."
Keabadian Surga;11;108;"Adapun orang-orang yang berbahagia, maka tempatnya di dalam surga, mereka kekal di dalamnya selama ada langit dan bumi, kecuali jika Tuhanmu menghendaki (yang lain); sebagai karunia yang tiada putus-putusnya."
Keabadian Surga;13;35;"Perumpamaan surga yang dijanjikan kepada orang-orang yang takwa ialah (seperti taman); mengalir sungai-sungai di dalamnya; buahnya tak henti-henti sedang naungannya (demikian pula). Itulah tempat kesudahan bagi orang-orang yang bertakwa, sedang tempat kesudahan bagi orang-orang kafir ialah neraka."
Keabadian Surga;14;23;"Dan dimasukkanlah orang-orang yang beriman dan beramal saleh ke dalam surga yang mengalir di bawahnya sungai-sungai, mereka kekal di dalamnya dengan seizin Tuhan mereka. Ucapan penghormatan mereka dalam surga itu ialah ""salaam""."
Keabadian Surga;15;48;Mereka tidak merasa lelah di dalamnya dan mereka sekali-kali tidak akan dikeluarkan daripadanya.
Keabadian Surga;18;3;mereka kekal di dalamnya untuk selama-lamanya.
Keabadian Surga;18;108;mereka kekal di dalamnya, mereka tidak ingin berpindah dari padanya.
Keabadian Surga;19;61;yaitu surga ´Adn yang telah dijanjikan oleh Tuhan Yang Maha Pemurah kepada hamba-hamba-Nya, sekalipun (surga itu) tidak nampak. Sesungguhnya janji Allah itu pasti akan ditepati.
Keabadian Surga;20;76;(yaitu) surga ´Adn yang mengalir sungai-sungai di bawahnya, mereka kekal di dalamnya. Dan itu adalah balasan bagi orang yang bersih (dari kekafiran dan kemaksiatan).
Keabadian Surga;21;102;mereka tidak mendengar sedikitpun suara api neraka, dan mereka kekal dalam menikmati apa yang diingini oleh mereka.
Keabadian Surga;23;11;(yakni) yang akan mewarisi surga Firdaus. Mereka kekal di dalamnya.
Keabadian Surga;25;15;"Katakanlah: ""Apa (azab) yang demikian itukah yang baik, atau surga yang kekal yang telah dijanjikan kepada orang-orang yang bertakwa?"" Dia menjadi balasan dan tempat kembali bagi mereka?""."
Keabadian Surga;25;16;Bagi mereka di dalam surga itu apa yang mereka kehendaki, sedang mereka kekal (di dalamnya). (Hal itu) adalah janji dari Tuhanmu yang patut dimohonkan (kepada-Nya).
Keabadian Surga;25;76;mereka kekal di dalamnya. Surga itu sebaik-baik tempat menetap dan tempat kediaman.
Keabadian Surga;29;58;Dan orang-orang yang beriman dan mengerjakan amal-amal yang saleh, sesungguhnya akan Kami tempatkan mereka pada tempat-tempat yang tinggi di dalam surga, yang mengalir sungai-sungai di bawahnya, mereka kekal di dalamnya. Itulah sebaik-baik pembalasan bagi orang-orang yang beramal,
Keabadian Surga;31;9;"Kekal mereka di dalamnya; sebagai janji Allah yang benar. Dan Dialah Yang Maha Perkasa lagi Maha Bijaksana."
Keabadian Surga;37;58;Maka apakah kita tidak akan mati?,
Keabadian Surga;37;59;melainkan hanya kematian kita yang pertama saja (di dunia), dan kita tidak akan disiksa (di akhirat ini)?
Keabadian Surga;38;54;Sesungguhnya ini adalah benar-benar rezeki dari Kami yang tiada habis-habisnya.
Keabadian Surga;39;73;"Dan orang-orang yang bertakwa kepada Tuhan dibawa ke dalam surga berombong-rombongan (pula). Sehingga apabila mereka sampai ke surga itu sedang pintu-pintunya telah terbuka dan berkatalah kepada mereka penjaga-penjaganya: ""Kesejahteraan (dilimpahkan) atasmu. Berbahagialah kamu! maka masukilah surga ini, sedang kamu kekal di dalamnya""."
Keabadian Surga;40;8;ya Tuhan kami, dan masukkanlah mereka ke dalam surga ´Adn yang telah Engkau janjikan kepada mereka dan orang-orang yang saleh di antara bapak-bapak mereka, dan isteri-isteri mereka, dan keturunan mereka semua. Sesungguhnya Engkaulah Yang Maha Perkasa lagi Maha Bijaksana,
Keabadian Surga;40;39;Hai kaumku, sesungguhnya kehidupan dunia ini hanyalah kesenangan (sementara) dan sesungguhnya akhirat itulah negeri yang kekal.
Keabadian Surga;42;36;"Maka sesuatu yang diberikan kepadamu, itu adalah kenikmatan hidup di dunia; dan yang ada pada sisi Allah lebih baik dan lebih kekal bagi orang-orang yang beriman, dan hanya kepada Tuhan mereka, mereka bertawakkal."
Keabadian Surga;43;71;"Diedarkan kepada mereka piring-piring dari emas, dan piala-piala dan di dalam surga itu terdapat segala apa yang diingini oleh hati dan sedap (dipandang) mata dan kamu kekal di dalamnya""."
Keabadian Surga;44;56;mereka tidak akan merasakan mati di dalamnya kecuali mati di dunia. Dan Allah memelihara mereka dari azab neraka,
Keabadian Surga;46;14;"Mereka itulah penghuni-penghuni surga, mereka kekal di dalamnya; sebagai balasan atas apa yang telah mereka kerjakan."
Keabadian Surga;48;5;supaya Dia memasukkan orang-orang mukmin laki-laki dan perempuan ke dalam surga yang mengalir di bawahnya sungai-sungai, mereka kekal di dalamnya dan supaya Dia menutupi kesalahan-kesalahan mereka. Dan yang demikian itu adalah keberuntungan yang besar di sisi Allah,
Keabadian Surga;50;34;masukilah surga itu dengan aman, itulah hari kekekalan.
Keabadian Surga;57;12;"(yaitu) pada hari ketika kamu melihat orang mukmin laki-laki dan perempuan, sedang cahaya mereka bersinar di hadapan dan di sebelah kanan mereka, (dikatakan kepada mereka): ""Pada hari ini ada berita gembira untukmu, (yaitu) surga yang mengalir di bawahnya sungai-sungai, yang kamu kekal di dalamnya. Itulah keberuntungan yang besar""."
Keabadian Surga;58;22;Kamu tak akan mendapati kaum yang beriman pada Allah dan hari akhirat, saling berkasih-sayang dengan orang-orang yang menentang Allah dan Rasul-Nya, sekalipun orang-orang itu bapak-bapak, atau anak-anak atau saudara-saudara ataupun keluarga mereka. Mereka itulah orang-orang yang telah menanamkan keimanan dalam hati mereka dan menguatkan mereka dengan pertolongan yang datang daripada-Nya. Dan dimasukan-Nya mereka ke dalam surga yang mengalir di bawahnya sungai-sungai, mereka kekal di dalamnya. Allah ridha terhadap mereka, dan merekapun merasa puas terhadap (limpahan rahmat)-Nya. Mereka itulah golongan Allah. Ketahuilah, bahwa sesungguhnya hizbullah itu adalah golongan yang beruntung.
Keabadian Surga;64;9;(Ingatlah) hari (dimana) Allah mengumpulkan kamu pada hari pengumpulan, itulah hari dinampakkan kesalahan-kesalahan. Dan barangsiapa yang beriman kepada Allah dan beramal saleh, niscaya Allah akan menutupi kesalahan-kesalahannya dan memasukkannya ke dalam jannah yang mengalir di bawahnya sungai-sungai, mereka kekal di dalamnya. Itulah keberuntungan yang besar.
Keabadian Surga;65;11;"(Dan mengutus) seorang Rasul yang membacakan kepadamu ayat-ayat Allah yang menerangkan (bermacam-macam hukum) supaya Dia mengeluarkan orang-orang yang beriman dan beramal saleh dari kegelapan kepada cahaya. Dan barangsiapa beriman kepada Allah dan mengerjakan amal yang saleh niscaya Allah akan memasukkannya ke dalam surga-surga yang mengalir di bawahnya sungai-sungai; mereka kekal di dalamnya selama-lamanya. Sesungguhnya Allah memberikan rezeki yang baik kepadanya."
Keabadian Surga;98;8;"Balasan mereka di sisi Tuhan mereka ialah surga ´Adn yang mengalir di bawahnya sungai-sungai; mereka kekal di dalamnya selama-lamanya. Allah ridha terhadap mereka dan merekapun ridha kepada-Nya. Yang demikian itu adalah (balasan) bagi orang yang takut kepada Tuhannya."
Sifat Surga dan Kenikmatannya;2;25;"Dan sampaikanlah berita gembira kepada mereka yang beriman dan berbuat baik, bahwa bagi mereka disediakan surga-surga yang mengalir sungai-sungai di dalamnya. Setiap mereka diberi rezeki buah-buahan dalam surga-surga itu, mereka mengatakan: ""Inilah yang pernah diberikan kepada kami dahulu"". Mereka diberi buah-buahan yang serupa dan untuk mereka di dalamnya ada isteri-isteri yang suci dan mereka kekal di dalamnya."
Sifat Surga dan Kenikmatannya;3;15;"Katakanlah: ""Inginkah aku kabarkan kepadamu apa yang lebih baik dari yang demikian itu?"". Untuk orang-orang yang bertakwa (kepada Allah), pada sisi Tuhan mereka ada surga yang mengalir dibawahnya sungai-sungai; mereka kekal didalamnya. Dan (mereka dikaruniai) isteri-isteri yang disucikan serta keridhaan Allah. Dan Allah Maha Melihat akan hamba-hamba-Nya."
Sifat Surga dan Kenikmatannya;3;133;Dan bersegeralah kamu kepada ampunan dari Tuhanmu dan kepada surga yang luasnya seluas langit dan bumi yang disediakan untuk orang-orang yang bertakwa,
Sifat Surga dan Kenikmatannya;3;136;"Mereka itu balasannya ialah ampunan dari Tuhan mereka dan surga yang di dalamnya mengalir sungai-sungai, sedang mereka kekal di dalamnya; dan itulah sebaik-baik pahala orang-orang yang beramal."
Sifat Surga dan Kenikmatannya;3;195;"Maka Tuhan mereka memperkenankan permohonannya (dengan berfirman): ""Sesungguhnya Aku tidak menyia-nyiakan amal orang-orang yang beramal di antara kamu, baik laki-laki atau perempuan, (karena) sebagian kamu adalah turunan dari sebagian yang lain. Maka orang-orang yang berhijrah, yang diusir dari kampung halamannya, yang disakiti pada jalan-Ku, yang berperang dan yang dibunuh, pastilah akan Ku-hapuskan kesalahan-kesalahan mereka dan pastilah Aku masukkan mereka ke dalam surga yang mengalir sungai-sungai di bawahnya, sebagai pahala di sisi Allah. Dan Allah pada sisi-Nya pahala yang baik""."
Sifat Surga dan Kenikmatannya;3;198;Akan tetapi orang-orang yang bertakwa kepada Tuhannya, bagi mereka surga yang mengalir sungai-sungai di dalamnya, sedang mereka kekal di dalamnya sebagai tempat tinggal (anugerah) dari sisi Allah. Dan apa yang di sisi Allah adalah lebih baik bagi orang-orang yang berbakti.
Sifat Surga dan Kenikmatannya;4;13;"(Hukum-hukum tersebut) itu adalah ketentuan-ketentuan dari Allah. Barangsiapa taat kepada Allah dan Rasul-Nya, niscaya Allah memasukkannya kedalam surga yang mengalir didalamnya sungai-sungai, sedang mereka kekal di dalamnya; dan itulah kemenangan yang besar."
Sifat Surga dan Kenikmatannya;4;57;"Dan orang-orang yang beriman dan mengerjakan amalan-amalan yang shaleh, kelak akan Kami masukkan mereka ke dalam surga yang di dalamnya mengalir sungai-sungai; kekal mereka di dalamnya; mereka di dalamnya mempunyai isteri-isteri yang suci, dan Kami masukkan mereka ke tempat yang teduh lagi nyaman."
Sifat Surga dan Kenikmatannya;4;122;Orang-orang yang beriman dan mengerjakan amalan saleh, kelak akan Kami masukkan ke dalam surga yang mengalir sungai-sungai di dalamnya, mereka kekal di dalamnya selama-lamanya. Allah telah membuat suatu janji yang benar. Dan siapakah yang lebih benar perkataannya dari pada Allah?
Sifat Surga dan Kenikmatannya;5;12;"Dan sesungguhnya Allah telah mengambil perjanjian (dari) Bani Israil dan telah Kami angkat diantara mereka 12 orang pemimpin dan Allah berfirman: ""Sesungguhnya Aku beserta kamu, sesungguhnya jika kamu mendirikan shalat dan menunaikan zakat serta beriman kepada rasul-rasul-Ku dan kamu bantu mereka dan kamu pinjamkan kepada Allah pinjaman yang baik sesungguhnya Aku akan menutupi dosa-dosamu. Dan sesungguhnya kamu akan Kumasukkan ke dalam surga yang mengalir air didalamnya sungai-sungai. Maka barangsiapa yang kafir di antaramu sesudah itu, sesungguhnya ia telah tersesat dari jalan yang lurus."
Sifat Surga dan Kenikmatannya;5;85;Maka Allah memberi mereka pahala terhadap perkataan yang mereka ucapkan, (yaitu) surga yang mengalir sungai-sungai di dalamnya, sedang mereka kekal di dalamnya. Dan itulah balasan (bagi) orang-orang yang berbuat kebaikan (yang ikhlas keimanannya).
Sifat Surga dan Kenikmatannya;5;119;"Allah berfirman: ""Ini adalah suatu hari yang bermanfaat bagi orang-orang yang benar kebenaran mereka. Bagi mereka surga yang dibawahnya mengalir sungai-sungai; mereka kekal di dalamnya selama-lamanya; Allah ridha terhadap-Nya. Itulah keberuntungan yang paling besar""."
Sifat Surga dan Kenikmatannya;7;43;"Dan Kami cabut segala macam dendam yang berada di dalam dada mereka; mengalir di bawah mereka sungai-sungai dan mereka berkata: ""Segala puji bagi Allah yang telah menunjuki kami kepada (surga) ini. Dan kami sekali-kali tidak akan mendapat petunjuk kalau Allah tidak memberi kami petunjuk. Sesungguhnya telah datang rasul-rasul Tuhan kami, membawa kebenaran"". Dan diserukan kepada mereka: ""ltulah surga yang diwariskan kepadamu, disebabkan apa yang dahulu kamu kerjakan""."
Sifat Surga dan Kenikmatannya;9;21;Tuhan mereka menggembirakan mereka dengan memberikan rahmat dari pada-Nya, keridhaan dan surga, mereka memperoleh didalamnya kesenangan yang kekal,
Sifat Surga dan Kenikmatannya;9;22;mereka kekal di dalamnya selama-lamanya. Sesungguhnya di sisi Allah-lah pahala yang besar.
Sifat Surga dan Kenikmatannya;9;72;"Allah menjanjikan kepada orang-orang mukmin, lelaki dan perempuan, (akan mendapat) surga yang dibawahnya mengalir sungai-sungai, kekal mereka di dalamnya, dan (mendapat) tempat-tempat yang bagus di surga ´Adn. Dan keridhaan Allah adalah lebih besar; itu adalah keberuntungan yang besar."
